{
  "rubric_id": "debug_process_v0",
  "title": "Debug process",
  "module": "debug",
  "status": "draft",
  "reviewed_by": null,
  "review_notes": null,
  "score_max": 2,
  "criteria": [
    {
      "id": "checked_supply_first",
      "description": "Verifies the supply rail before suspecting any other part.",
      "skill_id": "circuits1.dc_measurement",
      "uses_probe_log": true,
      "anchors": {
        "0": "Never checks the supply, or checks it only after swapping or blaming a part.",
        "1": "Checks the supply but not before probing downstream nodes.",
        "2": "First probe or first stated step is the supply voltage."
      }
    },
    {
      "id": "verified_ground",
      "description": "Confirms the ground reference is connected before trusting readings.",
      "skill_id": "circuits1.grounding",
      "uses_probe_log": true,
      "anchors": {
        "0": "Never mentions or checks ground.",
        "1": "Mentions ground without checking it.",
        "2": "Checks or explicitly confirms the ground reference."
      }
    },
    {
      "id": "isolated_before_swapping",
      "description": "Narrows the fault to a section or part before replacing anything.",
      "skill_id": "circuits1.fault_isolation",
      "uses_probe_log": true,
      "anchors": {
        "0": "Swaps parts with no narrowing.",
        "1": "Some narrowing, then swaps without a clear reason.",
        "2": "Isolates by measurement, then acts on that evidence."
      }
    },
    {
      "id": "stated_hypothesis",
      "description": "States what they think is wrong and what reading would confirm it.",
      "skill_id": "circuits1.ohms_law",
      "uses_probe_log": false,
      "anchors": {
        "0": "No hypothesis stated.",
        "1": "Vague guess with no predicted reading.",
        "2": "Specific hypothesis with a reading that would confirm or reject it."
      }
    }
  ]
}
